{
  "schema_version": "1.0",
  "event_id": "evt-example-0001",
  "timestamp": "2026-09-01T12:00:00.000Z",
  "task_type": "coding",
  "prompt_summary": "Add structured prompt observation to a coding workflow.",
  "intent_clarity": 9,
  "context_sufficiency": 8,
  "scope_definition": 8,
  "constraints_quality": 9,
  "acceptance_criteria": 7,
  "verification_plan": 6,
  "ambiguity_risk": "low",
  "strengths": [
    "The desired behavior and storage format are clear."
  ],
  "weaknesses": [
    {
      "category": "missing_verification",
      "severity": "medium",
      "message": "The required verification commands are not specified."
    }
  ],
  "improvement_suggestions": [
    "Name the commands that must pass before completion."
  ],
  "execution_signals": {
    "result_status": "completed",
    "files_changed": [],
    "tests_run": []
  },
  "usage": {
    "model": null,
    "input_tokens": null,
    "output_tokens": null,
    "cost_usd": null,
    "source": "unavailable",
    "estimation_method": null
  }
}
